{
  "artifact_class": "a0x-leg-protocol",
  "claim_ids": [],
  "descriptive_final_block_endpoint": {
    "model_card_index_field": "final_transformer_block_tuple_index",
    "required_equal_model_card_field": "num_hidden_layers",
    "rescues_primary": false,
    "role": "descriptive_sensitivity"
  },
  "empirical": true,
  "endpoint_indices": [
    6
  ],
  "evidence_eligible": false,
  "expert_validated": false,
  "identity": {
    "leg": "r1",
    "protected_tree_sha256": "9b2a4d07c36eab3141d45258f3956c00d735e2911969447a585e227ee7bbeaa8",
    "protocol_id": "a0x-r1-six-model-v1",
    "selection_corpus_sha256": "46c5cdf796f2abad709deb3066cfadd5fc6e6a30f55a737b3408e0a15b065c06",
    "source_base_commit": "188eb65b5e249923baddadeba52659f07fcd1609"
  },
  "inherited_rules": {
    "calibration": {
      "critical_successes": 17,
      "deterministic_seed": 20260815,
      "family_successes_at_least": 17,
      "maximum_false_positive_rate": 0.05,
      "method": "exact_family_blocked_binomial_primary_endpoint",
      "minimum_detectable_effect": 0.2597184664182352,
      "power": 0.8,
      "selected_families_per_domain": 4,
      "selected_family_count": 24,
      "selected_permutation_budget": 999,
      "selection_mode": "deterministic_predeclared",
      "target_effect_size": 0.3
    },
    "independence_audit": {
      "a0_case_text_reused": false,
      "a0_seed_reused": false,
      "a0_template_ids_reused": false,
      "source_protocol_id": "a0-automated-weak-proxy-v1.0.3",
      "source_protocol_merge_sha": "fc80976d3a256ed88e2d59f1a6f893e15154e3a0",
      "source_protocol_run_id": "a0-v1.0.3-e93a9faa"
    },
    "outcome_classes": {
      "failed": "failed",
      "non_interpretable": "non_interpretable",
      "null": "null",
      "positive": "positive"
    },
    "outcome_rules": {
      "failed": "integrity, identity, execution, data, or receipt gate fails before a valid statistic",
      "non_interpretable": "shortcut controls reach or exceed refusal threshold",
      "null": "all gates pass and positive rule is false",
      "positive": "all gates pass and primary_permutation_p <= 0.05 and macro_f1_margin_over_surface >= 0.10 and family_successes >= 17"
    },
    "primary_endpoint": {
      "is_max_statistic_selection": false,
      "layer": 6,
      "multiplicity": 1,
      "primary_view": "problem_plus_transformation",
      "surface_baseline_view": "problem_only",
      "token_site": "mean_transformation_span"
    },
    "protocol_type": "pre_output_replication",
    "runtime": {
      "requires_interactive_model_server": false,
      "runtime_device": "cpu"
    },
    "sensitivity_endpoints": {
      "interpretation": "descriptive_only",
      "layers": [
        0,
        2,
        4,
        6
      ],
      "may_replace_primary": false,
      "token_sites": [
        "sentinel",
        "final_transformation_token",
        "mean_transformation_span"
      ],
      "views": [
        "problem_only",
        "transformation_only",
        "problem_plus_transformation",
        "problem_plus_solution"
      ]
    },
    "shortcut_evaluation": {
      "a0_controls": [
        "bag_of_words_baselines",
        "character_ngram_baselines",
        "length_and_punctuation_baselines",
        "style_and_template_baselines",
        "provenance_classifiers",
        "problem_only_label_prediction",
        "leave_one_domain_out_surface_evaluation",
        "duplicate_and_near_duplicate_detection",
        "family_leakage_detection",
        "random_label_controls",
        "random_partition_controls",
        "generic_action_taxonomy_controls",
        "generic_transformation_taxonomy_controls",
        "adjacent_principle_proxy_controls"
      ],
      "macro_f1_threshold": 0.65,
      "margin_over_majority": 0.1
    },
    "thresholds": {
      "critical_successes": 17,
      "domain_direction_successes_minimum": 4,
      "family_successes_at_least": 17,
      "macro_f1_margin_at_least": 0.1,
      "primary_permutation_p_at_most": 0.05
    }
  },
  "model_output_accessed": false,
  "protocol_status": "frozen",
  "scientific_status": "exploratory",
  "sealed_targets_accessed": false,
  "source_protocol_path": "experiments/a0r1-independent-proxy/protocol.json",
  "source_protocol_raw_sha256": "ed113d1c0bfdb44b57c879e2995b610d0ecf528fccedb37fc9b89093be083fbf"
}
